title,description,link,pubDate,Processed Date,Processed Time,Sentiment,Summary
‘Ain’t No Way It Said That’: Tesla Driver Uses Grok. Then It Says Something Unexpected About Toyota Prius Drivers,'Choke on a bag of rusty spark plugs.',https://insideevs.com/news/768118/grok-tesla-toyota-prius/,2025-08-05 21:30:00,2025-08-06,15:12:25,NEUTRAL,'Choke on a bag of rusty spark plugs.'...
"APC Presale Crosses $3.22M as Investors Target Top Cryptos to Buy Now, Shiba Inu, SPX6900 Rally as Ethereum Holds Steady","Explore top cryptos to buy now, including Arctic Pablo Coin’s presale, Shiba Inu, SPX6900, and Ethereum’s $3,535 price stability for smart crypto investments.",https://www.analyticsinsight.net/cryptocurrency-analytics-insight/apc-presale-crosses-322m-as-investors-target-top-cryptos-to-buy-now-shiba-inu-spx6900-rally-as-ethereum-holds-steady,2025-08-05 21:30:00,2025-08-06,15:12:25,NEUTRAL,"Explore top cryptos to buy now, including Arctic Pablo Coin’s presale, Shiba Inu, SPX6900, and Ethereum’s $3,535 price stability for smart crypto investments...."
"Verify, Verify, Verify: How Technological Disruption is Redefining Nuclear Risk","The next wave of technological evolution is disrupting nuclear stability, reshaping verification, and challenging the future of arms control and nonproliferation.The post Verify, Verify, Verify: How Technological Disruption is Redefining Nuclear Risk appeared first on Stimson Center.",https://www.stimson.org/2025/verify-verify-verify-how-technological-disruption-is-redefining-nuclear-risk/,2025-08-05 21:25:31,2025-08-06,15:12:25,NEUTRAL,"The next wave of technological evolution is disrupting nuclear stability, reshaping verification, and challenging the future of arms control and nonproliferation.The post Verify, Verify, Verify: How T..."
Healthcare Tech Giants Post Record Quarters as AI Spending Hits $4 Billion,"The healthcare technology sector is experiencing unprecedented growth, with market valuations set to more than double within five years as artificial intelligence reshapes patient care delivery",https://hackernoon.com/healthcare-tech-giants-post-record-quarters-as-ai-spending-hits-$4-billion,2025-08-05 21:06:35,2025-08-06,15:12:25,NEUTRAL,"The healthcare technology sector is experiencing unprecedented growth, with market valuations set to more than double within five years as artificial intelligence reshapes patient care delivery..."
"Find Mining Launches A New Mobile Cloud Mining Platform, Easily Earn Daily Revenue In BTC, XRP, And SOL","(MENAFN - eTrendy Stock) San Francisco, California, USA, 5th August 2025, ZEX PR WIRE, Find Mining has officially launched its new mobile cloud mining platform, allowing users worldwide to easily ...",https://menafn.com/1109890336/Find-Mining-Launches-A-New-Mobile-Cloud-Mining-Platform-Easily-Earn-Daily-Revenue-In-BTC-XRP-And-SOL,2025-08-05 21:01:03,2025-08-06,15:12:25,NEUTRAL,"(MENAFN - eTrendy Stock) San Francisco, California, USA, 5th August 2025, ZEX PR WIRE, Find Mining has officially launched its new mobile cloud mining platform, allowing users worldwide to easily ......"
Is Switching from Bitcoin to Ethereum a Genius Move or Risk?,"Bitcoin vs Ethereum: Explore the 2025 cryptocurrency market, smart investment choices, and how cryptocurrency, DeFi, and NFTs are shaping future opportunities",https://www.analyticsinsight.net/bitcoin/is-switching-from-bitcoin-to-ethereum-a-genius-move-or-risk,2025-08-05 21:00:00,2025-08-06,15:12:25,NEUTRAL,"Bitcoin vs Ethereum: Explore the 2025 cryptocurrency market, smart investment choices, and how cryptocurrency, DeFi, and NFTs are shaping future opportunities..."
Trader Who Made $477M as Ethereum (ETH) Recently Hit a 2025 High Pivots to New Crypto Below $1,"Ethereum is facing a massive surge, meanwhile, Little Pepe has exploded gaining significant traction. Explore Ethereum, LILPEPE, and Crypto Trends.",https://www.analyticsinsight.net/cryptocurrency-analytics-insight/trader-who-made-477m-as-ethereum-eth-recently-hit-a-2025-high-pivots-to-new-crypto-below-1,2025-08-05 21:00:00,2025-08-06,15:12:25,NEUTRAL,"Ethereum is facing a massive surge, meanwhile, Little Pepe has exploded gaining significant traction. Explore Ethereum, LILPEPE, and Crypto Trends...."
Is Tesla Stock a Good Investment in 2025?,Explore Tesla Stock and recent Tesla Stock Price movements amid shifting EV Market Trends and global tech-driven growth.,https://www.analyticsinsight.net/stocks/is-tesla-stock-a-good-investment-in-2025,2025-08-05 20:45:00,2025-08-06,15:12:25,NEUTRAL,Explore Tesla Stock and recent Tesla Stock Price movements amid shifting EV Market Trends and global tech-driven growth....
"Grasshopper Bank adds capital, will use it to fuel expansion",The New York-based digital-only bank is seeking to partner with more brands after a recent deal opened the way to serving millions of AAA customers.,https://www.americanbanker.com/news/grasshopper-bank-adds-capital-will-use-it-to-fuel-expansion,2025-08-05 20:33:56,2025-08-06,15:12:25,NEUTRAL,The New York-based digital-only bank is seeking to partner with more brands after a recent deal opened the way to serving millions of AAA customers....
Is Amazon a Good Stock to Buy? A 2025 Investor’s Perspective,"Wondering if Amazon stock is worth investing in? Explore current trends, Amazon stock price movements, and expert opinions to evaluate its long-term potential.",https://www.analyticsinsight.net/stocks/is-amazon-a-good-stock-to-buy-a-2025-investors-perspective,2025-08-05 20:30:00,2025-08-06,15:12:25,NEUTRAL,"Wondering if Amazon stock is worth investing in? Explore current trends, Amazon stock price movements, and expert opinions to evaluate its long-term potential...."
